{
  "id": "VULN-004",
  "type": "FILE_UPLOAD",
  "endpoint": "/api/profile/upload",
  "http_method": "POST",
  "severity": "high",
  "description": "Server lacks file extension allowlist, permitting HTML file uploads.",
  "reproduction": {
    "headers": {
      "Cookie": "session_token=mock_alice_session_123",
      "Content-Type": "multipart/form-data; boundary=----WebKitFormBoundary7MA4YWxkTrZu0gW"
    },
    "payload": {
      "filename": "test-malicious.html"
    },
    "url_params": {},
    "test_user": "Alice"
  },
  "evidence": {
    "status_code": 200,
    "response_body": "{\"file\": {\"original_name\": \"test-malicious.html\", \"stored_name\": \"upload_99.html\"}}",
    "extracted_data": "Uploaded file upload_99.html"
  },
  "timestamp": "2026-09-27T14:47:25.428674Z"
}