{
  "id": "VULN-001",
  "type": "IDOR",
  "endpoint": "/api/users/2",
  "http_method": "GET",
  "severity": "high",
  "description": "Authenticated user can access another user's profile data via ID manipulation.",
  "reproduction": {
    "headers": {
      "Cookie": "session_token=5c0c1a8b5aaa640db6843ef80dab0f1541a32f6a4ea673af048fd9586163d207"
    },
    "payload": {},
    "url_params": {},
    "test_user": "Alice"
  },
  "evidence": {
    "status_code": 200,
    "response_body": "{\"user\":{\"id\":2,\"username\":\"Bob\",\"email\":\"bob@securebank.local\",\"role\":\"USER\",\"created_at\":\"2026-09-26 17:14:47\"}}",
    "extracted_data": "Exfiltrated profile for user Bob: email bob@securebank.local"
  },
  "timestamp": "2026-09-26T23:16:03.637483Z"
}